{
  "schema_version": 1,
  "allowed_roots": [
    "D:\\HooshiXContext\\repo",
    "D:\\Projects"
  ],
  "denied_roots": [
    "C:\\Users\\REPLACE_ME\\AppData\\Roaming\\tunnel-client\\secrets",
    "C:\\Users\\REPLACE_ME\\.ssh"
  ],
  "commands": {
    "git": "C:\\Program Files\\Git\\cmd\\git.exe",
    "python": "C:\\REPLACE_WITH_APPROVED_PYTHON\\python.exe",
    "powershell": "C:\\Windows\\System32\\WindowsPowerShell\\v1.0\\powershell.exe"
  },
  "audit_log": "C:\\ProgramData\\HooshiX\\ops\\audit.ndjson",
  "require_elevated": false,
  "allow_process_execution": true,
  "allow_elevated_mutation": false,
  "allow_elevated_process_execution": false,
  "max_command_seconds": 300,
  "max_output_bytes": 1048576,
  "max_file_bytes": 4194304,
  "max_list_entries": 1000,
  "max_audit_bytes": 67108864,
  "audit_backups": 5
}
